label,LinearSVC_pred,overall,summary,text_preview
Negative,Positive,1.0,"it worked for one wash and flooded my house, ...","it worked for one wash and flooded my house, .... it worked for one wash and flooded my house, then the plug sparked when i went to go unplug it. not worth the "
Neutral,Positive,3.0,Many bottles are too big to fit,Many bottles are too big to fit. I think that an appliance designed expressly for the purpose of storing wine really ought to have shelves sized to accommodate 
Neutral,Positive,3.0,Sometimes it works just fine. Every once in awhile,"Sometimes it works just fine. Every once in awhile. Sometimes it works just fine.  Every once in awhile, it looks like the dished haven't even gotten wet.  It i"
Neutral,Positive,3.0,product was as described but white plastic piece for hose ...,"product was as described but white plastic piece for hose .... product was as described but white plastic piece for hose connections, mounting bracket, and elec"
Positive,Negative,4.0,Decent Washer with Poor Rack Design,Decent Washer with Poor Rack Design. We bought this Bosch Ascenta SHE3AR75UC dishwasher after our old 10 year old Bosch dishwasher started to turn itself off mi
Positive,Neutral,5.0,"Bearing fit well, "" how to"" video link did ...","Bearing fit well, "" how to"" video link did .... Bearing fit well,"" how to"" video link did not work. I have done this job before so I didn't need it but others m"
Neutral,Negative,3.0,Great oven. Very powerful middle burner for boiling,Great oven. Very powerful middle burner for boiling. Great burner.  Very powerful middle burner for boiling.  Really like the blue lights under the knobs.  Its 
Negative,Positive,2.0,Don't do it,Don't do it. The refrigerator came quickly and is beautiful! It is also the bet price I found for atll refrigerator of this quality. The seller wa also really h
Neutral,Positive,3.0,Works fine and fits fine,Works fine and fits fine. Works fine and fits fine. Lasts longer than non-holmes filters. Just hate that they only still last about a month. Gets expensive over
Positive,Negative,4.0,Four Stars,"Four Stars. One out of three came with a major dent, where the white enamel had rubbed off."
Positive,Negative,5.0,Want to purchase another one.,"Want to purchase another one.. It works so well, that I would like to purchase another one.  I would recommend it to anyone.  You won't be disappointed."
Positive,Negative,5.0,Arrived as planned and had customer service contact me to ...,Arrived as planned and had customer service contact me to .... Arrived as planned and had customer service contact me to make sure product was what I had expect
Neutral,Positive,3.0,The fit in the stove is just a tad bit ...,The fit in the stove is just a tad bit .... The fit in the stove is just a tad bit off - which is weird. The plates fit in the stove but slide around and there 
Positive,Neutral,5.0,Five Stars,Five Stars. tout tait ok
Positive,Negative,4.0,We'll see...,We'll see.... I haven't yet installed them.  I'm having week-long guests the end of the month and I thought I'd hold on to them so that my stove will look brand
Positive,Neutral,4.0,Four Stars,Four Stars. apres un changement de connecteur ok parfait !
Neutral,Positive,3.0,a+,"a+. too expensive, you can by unbranded for 1/3 of GE price"
Neutral,Negative,3.0,you pay for what you get,you pay for what you get. Lasted for about 5 minutes than fried. A piece of trash
Positive,Negative,5.0,I was worried at first that the 10 foot cord ...,I was worried at first that the 10 foot cord .... I was worried at first that the 10 foot cord might be dangerous or overheat when plugged in.  I have had it a 
Neutral,Positive,3.0,Who knows?,Who knows?. I replaced my water filter on July 1st.  My GE refridge still states that it's time to replace filter.  I don't know if this is a filter error or if
Positive,Negative,5.0,Original part,"Original part. Exact same filter that came with my Samsung fridge. Made in Korea and it cost $15 more than the knockoff ""Superco"" made in China brand.

I don't "
Positive,Negative,5.0,"Shorter, but seemed to work, until seal leaked...Fixed!","Shorter, but seemed to work, until seal leaked...Fixed!. Update*** customer service read this review and sent me another!  That's a company standing behind thei"
Positive,Neutral,4.0,Good product except for poor stand.,Good product except for poor stand.. Works great.  The only weakness is the little plastic stand on the back is imprecise.  The unit sometimes tips over forward
Positive,Neutral,5.0,Works pretty good. Keep water changed and it will work ...,Works pretty good. Keep water changed and it will work .... Purchased to help add some heat and moisture to the air during the cold dry winter months.  Works pr
Neutral,Positive,3.0,poor fit,"poor fit. Can't beat this price, but didn't fit my washing machine perfectly, even though this was the recommended part number. Handle rubs on bottom"
Positive,Neutral,4.0,Stains,"Stains. We use this with our Vicks humidifier. If you use it with the Vicks vapo pads, it will stain immediately, and since it needs to be thrown out after gett"
Positive,Negative,5.0,works like the OEM Puresource 2 filter,works like the OEM Puresource 2 filter. These filters are not equivalent to the Puresource 2 filters.  The one I tried did not fit into my refrigerator and I di
Positive,Neutral,4.0,"Good, Solid Performance Commensurate w/ Price & Size","Good, Solid Performance Commensurate w/ Price & Size. --Edgestar Portable Countertop Dishwasher--

Pros:

The performance of this dishwasher is excellent given "
Positive,Negative,4.0,Eh... to expensive,"Eh... to expensive. I'm going up to four stars because I've had this, taped on, to my vent for a few weeks now and it hasn't melted or anything like that.

I'm "
Neutral,Negative,3.0,Three Stars,Three Stars. Terrible replacement cartridge. Very loud when get any water-refrigerator now make a clunking noise.
Positive,Negative,5.0,Most common failing part of this series of dryer. ...,Most common failing part of this series of dryer. .... Most common failing part of this series of dryer. The prior set lasted me 5.5 years that replace the orig
Neutral,Negative,3.0,Pay attention,Pay attention. I was under the impression that this was new unopened. I guess I'll pay closer attention next time. Trim parts missing and some assembly complete
Neutral,Positive,3.0,"Looks great, not great quality","Looks great, not great quality. It looks great, but not the best of quality.  Had to return the first one because the light panel didn't work.  I do recommend i"
Neutral,Positive,3.0,Seems expensive,Seems expensive. Does what it's supposed to. Not too hard of an install. Seems rather expensive for no better than it is made. Its probably the cheapest part of
Positive,Neutral,4.0,Mesh a bit loose than the original!,"Mesh a bit loose than the original!. Fits my dryer, no problem. The mesh is a bit loose but it does work. After 10 years the original one tore up. I hope this o"
Positive,Neutral,5.0,Plan to get some jet dry though to run about once every other week to keep the line and the unit from smelling like mold if you don't clean it after every use,Plan to get some jet dry though to run about once every other week to keep the line and the unit from smelling like mold if you don't clean it after every use. 
Negative,Positive,1.0,... don't last half as long as the off brand Best Air ones I get at,... don't last half as long as the off brand Best Air ones I get at. Picked these up since I needed them fast but they are expensive and don't last half as long
Negative,Positive,1.0,Worked perfectly after I installed it 12 months ago. ...,Worked perfectly after I installed it 12 months ago. .... Worked perfectly after I installed it 12 months ago. Stopped working yesterday without a sign of failu
Neutral,Positive,3.0,Three Stars,Three Stars. Work fine should be larger
Positive,Negative,4.0,Too much money,Too much money. I can get the same stove in ABC Warehouse for $150.00 cheaper. There are no details about this stove. Why would I buy a stove that has no detail
Negative,Positive,2.0,Buy the 3 pack.  Much cheaper that way.,Buy the 3 pack.  Much cheaper that way.. For anyone buying this.  Buy the 3 pack.  Much cheaper that way.  Good product.
Negative,Neutral,1.0,... inch longer and a bit stronger it would be perfect. bends easily and Very difficult to open and ...,... inch longer and a bit stronger it would be perfect. bends easily and Very difficult to open and .... If this product was six inch longer and a bit stronger 
Negative,Neutral,1.0,Messed up shilment,"Messed up shilment. Ordered the twin pack - not too hard, right? TWO (2) packages!!! Only received one. Gotta go through a whole darn pain in the @ss process to"
Neutral,Negative,3.0,Did not work as intended since I needed to buy ...,"Did not work as intended since I needed to buy .... Did not work as intended since I needed to buy more parts to make it work... And on top of that, I found tha"
Neutral,Positive,3.0,Three Stars,Three Stars. worked fine
Negative,Neutral,2.0,Only thing is there was a good sized dent in the stainless steel on the bottom ...,Only thing is there was a good sized dent in the stainless steel on the bottom .... Unit came on time and as described.  Only thing is there was a good sized de
Positive,Neutral,4.0,Four Stars,Four Stars. Started off with some charcoal but cleared up see quickly.
Positive,Negative,4.0,Four Stars,Four Stars. Didn't work but easy to get a refund.
Positive,Negative,5.0,Five Stars,Five Stars. Stopped my water dispenser from leaking immediately.
Positive,Negative,4.0,Got stuck,Got stuck. It actually got stuck in my refrigerator so I can't really get it out now
Positive,Negative,5.0,5 Star,5 Star. Excellent service had a issue sent back and was returned another immediately ~ Highly recommend!!! Makes ice fast!!
Positive,Negative,4.0,Wrong fit but worked out!,"Wrong fit but worked out!. Bought for upper part of fridge door, but didn't fit so had to make adjustments and use in lower part. The description didn't say whe"
Negative,Neutral,2.0,I guess it works but I couldn't stop getting the ...,I guess it works but I couldn't stop getting the .... I guess it works but I couldn't stop getting the tiny squiggly things out of the water. I must have ran 5 
Neutral,Positive,3.0,Three Stars,Three Stars. Fits as replacement.  Made of plastic not  as orginal
Positive,Neutral,5.0,Five Stars,Five Stars. a ok
Positive,Negative,4.0,No more early waking up and lagging heavy loads to Laundromat,"No more early waking up and lagging heavy loads to Laundromat. This product is heaven sent.

Prior to finding this product, I had to drag myself every three wee"
Positive,Negative,5.0,Just received my waterdrop replacements yesterday and installed one today ...,Just received my waterdrop replacements yesterday and installed one today .... Just received my waterdrop replacements yesterday and installed one today.  It di
Positive,Negative,4.0,after reading many reviews sounds like I'll be replacing in about 6 months will update ...,"after reading many reviews sounds like I'll be replacing in about 6 months will update .... Just received & installed. Only been in a few days, after reading ma"
Negative,Positive,2.0,Two Stars,Two Stars. worked fine
Neutral,Positive,3.0,Not too happy with the white,Not too happy with the white. I ordered silver finish and got white. Not too happy with the white. Also had a few dents in it
Neutral,Positive,3.0,It looks great and was very easy to,"It looks great and was very easy to. The beverages aren't quite as cold as I would have expected, even though it is set at its lowest rating.  It looks great an"
Positive,Negative,4.0,not good. And be sure to duct tape your screwed ...,not good. And be sure to duct tape your screwed .... This device works very well...one word of caution if you use a cordless drill: use the clutch setting at lo
Positive,Negative,5.0,buy buy buy !!,buy buy buy !!. definite a buy protect from all the grease kids hands.
Neutral,Positive,3.0,Does what it says it does.,"Does what it says it does.. These filters are hard to come by for portable humidifier products
but they do exactly do what they are suppose to do ( admittedly
w"
Positive,Neutral,4.0,Good product,Good product. The hood is well constructed and I was able to install it without any issues. LED under hood lighting is adequate and front touch fan controls are
Positive,Neutral,5.0,Permanent Solution To Loose Handle Problem,Permanent Solution To Loose Handle Problem. A number of reviews have commented that the handle gets loose after a period of time; the solution to that problem i
Positive,Neutral,4.0,Temp unit,"Temp unit. Unit works well. Remotes do not match base, but you can adjust base to get best match. Remotes still read wrong temp."
Positive,Negative,4.0,Pretty decent ice maker,"Pretty decent ice maker. I hooked this up this weekend and started using it.  I would give it 5 stars, but the ice in the dispenser end melts rather quickly, me"
Neutral,Positive,3.0,Three Stars,Three Stars. not the right color
Positive,Negative,4.0,"Good filter, but doesn't last long","Good filter, but doesn't last long. My humidifier goes thru these filters in a very short time. Don't know why, unless six weeks is the life of a filter."
Neutral,Negative,3.0,This is very stiff!,This is very stiff!. The plastic on this item never loosens up! I have had it for months. It is toooo stiff to allow food to go through it! I have to pull it ou
Neutral,Negative,3.0,They all don't stay on.,They all don't stay on.. They all  don't stay on.
Positive,Neutral,4.0,Independent Lab Analysis Desired,"Independent Lab Analysis Desired. Seems fine to me, but how does one really know what's inside? Would be nice if it came with some lab certification."
Positive,Neutral,4.0,Good value.,"Good value.. Installation in my refrigerator was seamless.  I ran several glasses of water through the filter, but never saw much by way of charcoal particles. "
Positive,Negative,5.0,A Must Have For PUR Water Items,A Must Have For PUR Water Items. You have to buy these but I'll review anyway. I love my PUR water filtered water. Our water isn't bad here but we had one of th
Positive,Negative,5.0,good,good. This was identical to the original but unfortunately replacing it didn't make my icemaker work again
Positive,Neutral,4.0,It is what it is,It is what it is. I bought this because I needed an in expensive hygrometer for a spare cigar humidor. I calibrated it with a 69% boveda pack and it read 86% r/
Neutral,Negative,3.0,Three Stars,Three Stars. Takes forever to fill
Positive,Negative,5.0,Five Stars,"Five Stars. Well made, but had to return because the microwave it fit was defective"
Positive,Negative,4.0,it looks like either it misses the correct paint or it got ...,it looks like either it misses the correct paint or it got .... delivered on time. the only star I took off is I don't know what's in the last pic. it looks lik
Negative,Positive,2.0,Works like it should but the flow arrows on the label ...,Works like it should but the flow arrows on the label .... Works like it should but the flow arrows on the label are pointing the wrong direction ( opposite of 
Positive,Negative,5.0,smaller than a pack of gum,smaller than a pack of gum. Another one here who bought this specifically as a humidity meter for their guitar case.  24 hr exposure to the salt test yielded a 
Neutral,Negative,3.0,"Supposed to fit my dishwasher model, but not the same. Tension is wrong.","Supposed to fit my dishwasher model, but not the same. Tension is wrong.. This spring says it will replace the one for my dishwasher model, but it's not the sam"
Positive,Negative,5.0,Poor operation UPDATE very satisfied,Poor operation UPDATE very satisfied. Have had for 9 months and in MI seemed like it might be working properly although humidity and dew points seemed to not ch
Negative,Neutral,2.0,Accurate but very slow response,"Accurate but very slow response. The readings are very accurate for temperature, though humidity is the larger displayed value and that's less consistent. The m"
Neutral,Positive,3.0,Three Stars,"Three Stars. Arrived when promised, form, fit, & function seem adequate."
Negative,Positive,2.0,Two Stars,Two Stars. Arrived dameged
Neutral,Positive,3.0,Great,Great. Great item saved me money doing it myself ..
Negative,Positive,2.0,It looks nice and it is easy to use but the fan ...,It looks nice and it is easy to use but the fan .... It looks nice and it is easy to use but the fan is situated on the left side of the unit and only is strong
Negative,Neutral,1.0,Inconvenient crappy design makes it hard to clean,Inconvenient crappy design makes it hard to clean. Junk. Rickety meat drawer that comes apart periodically. Inconvenient crappy design makes it hard to clean. S
Positive,Negative,4.0,I had this washing machine for two years now. ...,I had this washing machine for two years now. .... I had this washing machine for two years now. The only problem is the drain hose that has hole in it. I was t
Neutral,Positive,3.0,Works but...,"Works but.... Not as pictured, requires termination and reusing some of the wire heat shields. Box is ERP (Exact Replacement Parts) and part is identical to muc"
Negative,Positive,2.0,Almost great,"Almost great. Worked great initially, but developed problems with the ignition a little over a year of ownership. No info yet on DIY solutions."
Neutral,Positive,3.0,... got to put this hood up because it is like Ross-from-Friends's teeth,... got to put this hood up because it is like Ross-from-Friends's teeth. I never got to put this hood up because it is like Ross-from-Friends's teeth. Glowing 
Negative,Neutral,2.0,Two Stars,"Two Stars. wasnt what i thought
magnet part is a joke"
Negative,Positive,2.0,needed a replacement for my original dryer filter that started ...,needed a replacement for my original dryer filter that started .... needed a replacement for my original dryer filter that started coming apart. This one works 
Negative,Positive,2.0,Very cute & useful for mobility *UPDATE* Not Great,"Very cute & useful for mobility *UPDATE* Not Great. Day 1
SO far so cold!  Very cute & useful for mobility.
However, It's cooled by a soundly fan (equivalent to"
Neutral,Positive,3.0,careful don't rush,careful don't rush. Tight to install. Works great.
Positive,Neutral,5.0,"... as it was a ""generic"" basket - but works fine.","... as it was a ""generic"" basket - but works fine.. Wasn't sure it would fit as it was a ""generic"" basket - but works fine."
Positive,Neutral,4.0,Review of Venta LW14,"Review of Venta LW14. I have read reviews of the larger Venta models and decided to purchase one. However, this smaller model was sufficient for the room I plac"
Positive,Negative,5.0,It fit well.,It fit well.. The belt fit great. Unfortunately the main bearing was the part that went out. It was no help with the banging when it spun. They don't make washe
Negative,Neutral,1.0,Expensive to return,Expensive to return. Didn't need it but it cost $6.50 to mail it back.
Negative,Positive,2.0,I like the choice of ice sizes,I like the choice of ice sizes. I have purchased two of these already because they last exactly 22 months. I like the choice of ice sizes. I love the size of th
Positive,Negative,5.0,Good product for a VERY good price,"Good product for a VERY good price. I bought the 3-pack of these. While I only used one so far, they're a good buy. It was hard determining if it would work in "
Neutral,Positive,3.0,Fit for the machines that I have which was listed in description,"Fit for the machines that I have which was listed in description. Good product, but too long to get to me and I should have just went to hardware store to pick "
Neutral,Positive,3.0,A different color,A different color. The product works fine and is identical except the color. I have a black grill on my stainless steel fridge and the white handle sticks out l
Neutral,Positive,3.0,Three Stars,Three Stars. does what it needs to do
Negative,Neutral,1.0,Not accurate.,Not accurate.. I returned the first one as I could not calibrate it against the Extech cal kit (33% and 75%).  The replacement does not work any better.  You sh
Negative,Neutral,1.0,The first order I received was damaged so I shipped ...,The first order I received was damaged so I shipped .... The first order I received was damaged so I shipped it back and got a new one.  They refunded the money
Neutral,Positive,3.0,ideal  oven for places with unstable electricity supply,ideal  oven for places with unstable electricity supply. Because the stove is as described and  the oven  works  even when there  is  power  outage so  your bak
Neutral,Negative,3.0,Had to send back for a new one..,Had to send back for a new one... DOA
Positive,Negative,5.0,Good value!!,"Good value!!. At first it tasted weird, but after a couple of uses, the water tasted great again. So I supposed it needed to go through some priming.
One thing "
Negative,Neutral,2.0,... one that went out but when I priced one like it was 200 or generic was 125 so for ...,... one that went out but when I priced one like it was 200 or generic was 125 so for .... It makes ice it's just way slower than the old one that went out but 
Neutral,Positive,3.0,This Model Works Just Fine,This Model Works Just Fine. I returned this icemaker.  It would have been nice if the seller included the wiring adapter.  I ended up buying it locally from Tri
Negative,Positive,2.0,Wanted to like this but...,Wanted to like this but.... I've been using this for three weeks now and am finding that my nose and my son's nose are still very dry. I really wanted to like t
Neutral,Positive,3.0,Three Stars,Three Stars. Got me up and running again.  A bit pricey though.
Neutral,Negative,3.0,Three Stars,Three Stars. Unfortunately one of them is leaking.
Negative,Neutral,1.0,Wasn't great the plastic covering came off the long brush and ...,Wasn't great the plastic covering came off the long brush and .... Wasn't great the plastic covering came off the long brush and was afraid it would rip the alu
Negative,Positive,2.0,Doesn't last long,"Doesn't last long. Works great, but only lasts about 5 weeks at most... I know we have hard water but this thing should last longer for the price..."
Neutral,Positive,3.0,Three Stars,Three Stars. Works good.
Neutral,Positive,3.0,The top end that attaches to the washer drum is ...,The top end that attaches to the washer drum is .... The top end that attaches to the washer drum is too small for my WF210AN washing machine IF the bushing is 
Negative,Neutral,2.0,Not recommended,Not recommended. This fridge had a receipt in the box showing it as apparently being sold for $60 by Walmart. I believe I paid ~$80 for it. That is not acceptab
Negative,Positive,1.0,We tried 2 filters but the water pressure through the ...,We tried 2 filters but the water pressure through the .... We tried 2 filters but the water pressure through the filter drops dramatically and makes the water s
Neutral,Positive,3.0,Three Stars,Three Stars. yip they worked but crazy expensive
Positive,Negative,4.0,DRYER REPAIR KIT,"DRYER REPAIR KIT. To anyone ordering this kit for a 27"" Whirlpool Cabrio, don't.
The heating element is incorrect for this model.
Pictured is what the dryer has"
Positive,Negative,5.0,"LG Model # LFX28978ST - So, this damn spring ...","LG Model # LFX28978ST - So, this damn spring .... LG Model # LFX28978ST - So, this damn spring breaks 2 months after the 5 year extended warranty runs out.  Cou"
Negative,Neutral,2.0,Does not work as well as genuine GE filter,"Does not work as well as genuine GE filter. just recently installed, right off the bat i noticed that the flow of water was much weaker than it had been with th"
Positive,Negative,5.0,I'M LEARNING CENTIGRADE,"I'M LEARNING CENTIGRADE. I purchased three of these several weeks ago. Two of them are being used currently. One in my freezer, one in my green house both are w"
Negative,Positive,2.0,Read this first!,Read this first!. It's a great indoor thermometer for HVAC use in a home but changing from Celsius to Fahrenheit is often a mystery. To switch from one to the o
Negative,Positive,2.0,Not cleanable.,Not cleanable.. Not ver sturdy. Cannot clean in oven like some. I tried to soak them and finally scrub them and they did not clean.
Neutral,Negative,3.0,Weak Metal Clasp,"Weak Metal Clasp. Kenmore dryer, the pin would not hold in the clasp/latch. The metal clasp (pictured) was not strong enough to hold the door closed. I was able"
Positive,Negative,4.0,Get what you pay for!,Get what you pay for!. Not sure it is as good as advertised!  Smaller than the product number it says it replaces.
Neutral,Negative,3.0,"Nothing was wrong with the part itself however, most ...","Nothing was wrong with the part itself however, most .... Nothing was wrong with the part itself however, most reviews suggested that this model was  compatible"
Positive,Negative,4.0,2 strikes...,"2 strikes.... The first unit initially was DOA out of the box, Amazon replaced it with a new unit.  The second unit failed just after the return period expired;"
Positive,Neutral,5.0,"Nothing big can get into the garbage disposal, and when the center is lowered","Nothing big can get into the garbage disposal, and when the center is lowered. Looked EVERYWHERE for this stopper for our Insinkerator.  They are SO HANDY.  Not"
Negative,Positive,1.0,wiring harness for Kenmore not included as stated,"wiring harness for Kenmore not included as stated. If you have a Kenmore there is no wiring harness included in this product, it comes with a couple different o"
Positive,Negative,4.0,"Filter ""aurally"" tells me when I'm saving money on filtered water!","Filter ""aurally"" tells me when I'm saving money on filtered water!. Product shipped on time and arrived carefully packaged. The flow rate of water was good and "
