label,LinearSVC_pred,overall,summary,text_preview
Negative,Positive,2.0,Two Stars,Two Stars. ok but lots of black water comes out at first
Neutral,Negative,3.0,kinky,kinky. Kinks.
Neutral,Negative,3.0,Loud noise from the refrigerator when I replaced the filter ...,"Loud noise from the refrigerator when I replaced the filter .... Loud noise from the refrigerator when I replaced the filter.  I have had that happen before, bu"
Neutral,Positive,3.0,Three Stars,Three Stars. good product
Neutral,Negative,3.0,2 important mistakes,2 important mistakes. Makes ice as advertised. noisy. ice is barely below freezing so melts quickly in room temperature drinks. noisy. at largest setting still 
Positive,Neutral,4.0,It did fit the only thing I think it wasn't ...,It did fit the only thing I think it wasn't .... It did fit the only thing I  think it wasn't exactly for my washer as I cannot shut the door unless I lock it o
Neutral,Negative,3.0,So stiff it won't let the water drain,"So stiff it won't let the water drain. Not sure if it will get more flexible with time, but I've had it for a month and still have to physically push on the edg"
Neutral,Positive,3.0,These handle covers need to be a little bit more ...,These handle covers need to be a little bit more .... These handle covers need to be a little bit more tighter. They slide on the door handles. I rather put the
Positive,Neutral,5.0,You will need this part if your spider arm broke ...,You will need this part if your spider arm broke .... You will need this part if your spider arm broke. If your spider arm brakes the drum becomes wobbly and ru
Neutral,Negative,3.0,Bad shipment?,Bad shipment?. The box was already open when it arrived but the filter itself was still intact.
Negative,Neutral,2.0,UGH!!! Maybe I should read better,"UGH!!! Maybe I should read better. It's not really the products fault that it got only two stars from me.  My question is ""What stove has (3)6"" burners and (1)8"
Positive,Negative,4.0,Accessory Pieces,Accessory Pieces. Good quality item but didn't need as the site suggested.  Returned them and I cost me $$$ that I really didn't need to spend in the first plac
Positive,Negative,5.0,Started cooking again,Started cooking again. This was a name brand and not some knock off product - plugged it in the stove and I've been cooking ever since
Neutral,Positive,3.0,Not what I had in mind,Not what I had in mind. I found this tough to use. I bought it for baking but I found it not suitable for cakes.
Positive,Negative,4.0,"the water doesn't have a funny taste, (our waters terrible) and the ice is ...","the water doesn't have a funny taste, (our waters terrible) and the ice is .... They work the same as Samson filters, the water doesn't have a funny taste, (our"
Positive,Neutral,4.0,Four Stars,Four Stars. a little narrower than the original but it should work.
Negative,Neutral,2.0,Two Stars,"Two Stars. One part was broken,one part wasnt."
Positive,Neutral,4.0,"Works well, but has a nuisance design issue","Works well, but has a nuisance design issue. The ice maker appears to be working fine. It came with a wiring harness with the correct plugs, however it had an i"
Neutral,Negative,3.0,OK with reservations,"OK with reservations. The filter installed without any problem, but the business end was coated with a film of acrid-smelling clear grease. A few carbon particl"
Positive,Neutral,5.0,Five Stars,Five Stars. ok
Neutral,Negative,3.0,Better than terrible,"Better than terrible. My replacement element failed about a week ago. Like many others here, it was the inexpensive element purchased from a company named Senec"
Negative,Positive,2.0,Two Stars,Two Stars. ripped clothes apart!
Positive,Negative,5.0,namely dumping the cheap plastic parts for sturdy metal.,namely dumping the cheap plastic parts for sturdy metal.. The cheap quality of my Whirlpool dishwasher was driving me nuts!  The top rack regularly collapsed on
Negative,Positive,1.0,Looks like it is a little smaller than the original but ...,Looks like it is a little smaller than the original but .... Why does whirlpool always make change of the rubber pad but makes no improvement at all? This set i
Neutral,Positive,3.0,The configuration is great but the rack gets completely rusty in about a ...,The configuration is great but the rack gets completely rusty in about a .... The configuration is great but the rack gets completely rusty in about a year. I k
Negative,Neutral,1.0,Won't work with Esick Air 8000 series.,Won't work with Esick Air 8000 series.. This wick will NOT work with an Esick Air 8000 series humidifier. It fits fine but it won't wick the water up. It took 6
Neutral,Positive,3.0,Three Stars,Three Stars. Works but not as firm as the original rubber Bellow.
Positive,Neutral,5.0,It lights my fire.,"It lights my fire.. Oh yes, this one heats me up.  Although I was tempted to turn it on first then put it in, I didn't want something to explode, so I put it in"
Negative,Positive,2.0,order 2pack get 1,"order 2pack get 1. was originally listed as a 2 pack, I got one filter, a ripoff at this price"
Negative,Neutral,1.0,Great if you like wet clothes,"Great if you like wet clothes. I've had many different driers over the years, and they've all dried clothes. The only differences were capacity, heat source, an"
Neutral,Positive,3.0,Keep looking,"Keep looking. I was so excited to have a dish washer in my apartment. This unit wouldn't fit under my cabinets, so I bought a cart from Lowes to put it on.

Pro"
Neutral,Positive,3.0,Best price search,Best price search. The item had a defective marriage of the wire screen to the plastic frame. I hope it holds.
Positive,Neutral,5.0,Good replacement part,"Good replacement part. This unit is just what I needed and at a fair price.  However, these things do not last forever (this is my third unit, fourth if you cou"
Negative,Neutral,1.0,too flimsy and collapses on itself,"too flimsy and collapses on itself. too flimsy and collapses on itself. great concept, though"
Negative,Positive,2.0,Two Stars,Two Stars. Great
Negative,Positive,2.0,dishwasher is new and in perfect working condition so reason is not due to washer ...,dishwasher is new and in perfect working condition so reason is not due to washer .... didnt adhere for more than couple washes.....dishwasher is new and in per
Positive,Negative,5.0,As good as the old Pur filters,As good as the old Pur filters. I had concerns before buying this product after reading the mixed reviews. It was my first time switching over from the disconti
Neutral,Negative,3.0,Good While It Lasted,"Good While It Lasted. The machine performed well for about one year after I purchased it.  However, it stopped working yesterday and will not power on today.  N"
Neutral,Negative,3.0,Ok,Ok. One filter turned all out water and ice orange
Negative,Positive,2.0,Works on XP machines only,Works on XP machines only. I bought the Extech RHT10 from a local Grainger Supply store and spent around 10 hours trying to get it installed on a Vista and Wind
Neutral,Negative,3.0,"Good item, short life, poor customer service","Good item, short life, poor customer service. I have had this device for three years. The outside sensor has just quit working.
Things I liked:
- The temperatur"
Neutral,Negative,3.0,Three Stars,"Three Stars. Refrigerator doesn't recognize this filter, so filter warning light has not reset.
Update: refrigerator did eventually recognize that filter and no"
Neutral,Negative,3.0,Replacement fit for Matag MDB700,"Replacement fit for Matag MDB700. Arrived in damaged box, not packaged the best as one lid had a broken hinge, not a big deal as we won't use them all the time."
Neutral,Positive,3.0,Planned Obsolescence.,"Planned Obsolescence.. These bins are not adjustable - there's only one slot for them in the fridge, and there is no reason to remove them.
Designing them as re"
Positive,Negative,5.0,No more stuck ice cubes!,No more stuck ice cubes!. Direct replacement for my Amana DRS2660BW fridge.
Negative,Neutral,2.0,Danby DBC120BLS Beverage Center - Stainless Steel,"Danby DBC120BLS Beverage Center - Stainless Steel. Doesn't really get too cold, doesn't latch closed well- even a small bump opens the door. The lighting inside"
Neutral,Positive,3.0,Three Stars,"Three Stars. Belows arrived quickly, but had no drain holes.  Was able to make it work, though."
Positive,Negative,5.0,It saves me so much time...,It saves me so much time.... I recommend the Edgestar to anyone. I scrub the dishes before loading and I only use the 45min wash cycle about once or twice a wee
Neutral,Positive,3.0,Three Stars,Three Stars. NEEDS TO BE BIGGER WRITING SPACE!
Negative,Positive,1.0,The 8 inch was a perfect match and works perfectly,The 8 inch was a perfect match and works perfectly. I purchased a 6 inch and an 8 inch cooktop element for my stove using the order number where I purchased my 
Negative,Positive,1.0,only one box not 180 boxes!!!,"only one box not 180 boxes!!!. Scam, you will only get one random box of bags, not the promised 180 boxes."
Positive,Neutral,5.0,Five Stars,Five Stars. At last my silverware will no longer fall through the holes!
Positive,Neutral,4.0,Nice clean clothes,"Nice clean clothes. Does a great job of washing, and the spin dryer does great as well. I am disappointed however that it is rather loud when washing. I have se"
Positive,Negative,5.0,Best Washing Machine!,"Best Washing Machine!. After buying several ""so-called"" top of the line front loaders, over the past few years, I had enough and sent them all to the curb! (The"
Positive,Neutral,5.0,Five Stars,Five Stars. ok
Positive,Neutral,4.0,Very good for small or medium house.,Very good for small or medium house.. For hydro-air system that doesn't heat the air as much as a direct duct wrap the supply line around the heating pipe to wa
Neutral,Positive,3.0,It worked great to begin with then hasn't worked great since,It worked great to begin with then hasn't worked great since. I use this item 24 hours a day.  It worked great to begin with then hasn't worked great since.  Th
Positive,Negative,4.0,Don't Judge A Toy By How It Looks,Don't Judge A Toy By How It Looks. This toy looks rather normal but turns out to be the longest lasting toy my dog has ever had. Bought this last year and my do
Positive,Negative,5.0,"Missing faceplate, different from product picture","Missing faceplate, different from product picture. I ordered two of these, and neither one looks quite like the product photo. There is a plastic faceplate whic"
Neutral,Negative,3.0,hmm.. in warm weather (our fridge is in ...,"hmm.. in warm weather (our fridge is in .... hmm.. in warm weather (our fridge is in the garage) one of the pieces unstuck and fell off.  It stuck back on, but "
Positive,Neutral,5.0,Holmes HWF75 Cool Mist Humidifer Wick Filter,"Holmes HWF75 Cool Mist Humidifer Wick Filter. The filter that I ordered is exactly to the original manufacturer's. It has the glued seam, white wick. All the bl"
Negative,Positive,2.0,"Great look,  but that's it","Great look,  but that's it. Have had it for a couple years now.  Wife is always complaining.  Gas leaks under the cabinet (changed lines and hook ups multiple t"
Positive,Negative,4.0,Drunken Review #12,"Drunken Review #12. As I sip from my whiskey, ice from this machine used to cool...

My refrigerator came with the house I purchased and I'd rather move than pu"
Neutral,Negative,3.0,Can't use the water on my fridge,Can't use the water on my fridge. I bought this because the water dispenser on my fridge is horribly slow.  I thought the filter would be bypassed and I could j
Negative,Neutral,2.0,Did not meet expectations.,"Did not meet expectations.. This was a gift to our daughter.  She states that it does not turn out ice fast enough.  Very slow to turn out the first 10 cubes, t"
Neutral,Positive,3.0,Not the Wisest of Designs,"Not the Wisest of Designs. Notice how close the center burner is to the controls.  There might be a reason or two why this product is on clearance, but it looks"
Negative,Neutral,1.0,Large pans don't fit my burners at all. Have ...,Large pans don't fit my burners at all. Have .... Large pans don't fit my burners at all. Have been dealing with wobbly burners and will probably just chuck the
Neutral,Positive,3.0,Over all I'm happy. Price was reasonable,"Over all I'm happy. Price was reasonable. Over all I'm happy. Price was reasonable.  Few minor things.
Installation was hard. The slide out glass doesn't align "
Positive,Negative,4.0,This fit my Samsung fridge just fine. I have a water tester and it tested ...,This fit my Samsung fridge just fine. I have a water tester and it tested .... This fit my Samsung fridge just fine. I have a water tester and it tested at 260 
Neutral,Positive,3.0,It works,"It works. Not impressed with the overall Skuttle design for the humidifier, but it works and I've replaced mine easily a few times over the last 10 years."
Negative,Neutral,2.0,Two Stars,Two Stars. color was more of a yellow compared to my almond stove.
Negative,Positive,2.0,SPWD1470C,"SPWD1470C. I use a Summit Professional Washer Dryer, model 1470C. The washer function works great. The dryer stopped working after about a year and it took the "
Positive,Neutral,4.0,It was good..but it didn't fit,"It was good..but it didn't fit. This item is good, had to return it because it didn't fit. Quality is good."
Positive,Neutral,5.0,"They work, OK?","They work, OK?. Washer hoses that work  Enough said"
Neutral,Negative,3.0,Maybe they should come up with a better system to keep grate from scratching stove,Maybe they should come up with a better system to keep grate from scratching stove. Way overpriced for what you get.  Tube of Silicone and few rubber feet. shou
Neutral,Positive,3.0,decent,"decent. I had to return the 1st one. Product seems to have ""machine"" scratches on it. The second one was better, so I decided to keep it, but it isn't perfect, "
Positive,Negative,5.0,Phenomenal product!,Phenomenal product!. It's pretty rare for me to be as impressed with a chance-purchase as I am with this one.  We own a large-capacity cool-mist humidifier with
Negative,Neutral,1.0,and looks like the wrong hose sizes were,"and looks like the wrong hose sizes were. Problems since day one, and looks like the wrong hose sizes were sent"
Neutral,Positive,3.0,Three Stars,"Three Stars. it works, but can only turn clock wise. My old one could turn counter clock wise."
Positive,Negative,5.0,Quest for better sleep. CO2 meter and Air quality meter to guide you in the right direction.,Quest for better sleep. CO2 meter and Air quality meter to guide you in the right direction.. First impression is excellent. All measurements are displayed very
Positive,Neutral,4.0,... some of the plastic off so it could be easily inserted and removed,"... some of the plastic off so it could be easily inserted and removed. needed to file some of the plastic off so it could be easily inserted and removed, but i"
Positive,Neutral,4.0,Display,Display. Nice display. Thought something was wrong with the comfort icons not displaying. Read manual and if the temp is above 79 degrees F no icon will display
Positive,Neutral,5.0,These are folded and become triangular unfolded. I flatten ...,These are folded and become triangular unfolded. I flatten .... These are folded and become triangular unfolded.  I flatten mine out and weight it down with boo
Negative,Positive,1.0,Advertised like new. Compressor was not working on arrival,Advertised like new. Compressor was not working on arrival. Advertised like new. Compressor was not working on arrival. Got a full refund with no problem.
Negative,Neutral,2.0,"So, so. Poor fit","So, so. Poor fit. Average, but fit issues...so rating them lower. Not as universal of a fit as we hoped for. I do like the black finish, it has held up okay, bu"
Negative,Positive,2.0,Seems like they always rust,Seems like they always rust. Seems like they always rust. I hav apartments and it seems like every time a tenant moves Im replacing them.
Neutral,Positive,3.0,Three Stars,Three Stars. Good
Negative,Neutral,2.0,Two Stars,Two Stars. didn't last 6 months!
Neutral,Negative,3.0,Three Stars,Three Stars. This come broke went I was connecting to the electricity
Neutral,Negative,3.0,Wrong Part,"Wrong Part. After many (4) attempts to find the correct part through various vendors, even directly through Whirlpool, the wrong parts were sent 4 times. Whirlp"
Neutral,Positive,3.0,Steam fresh a joke,Steam fresh a joke. Before purchasing this washer/dryer combo I owned a Whirlpool duet at my previous home.  I thought I would try this LG since it got good rev
Negative,Neutral,1.0,noisy,"noisy. its ok,  slow response from air king for a problem.  it is not quiet and the light is quite dim.  would not recommend."
Neutral,Positive,3.0,Three Stars,"Three Stars. Not the same durability, but for the price it worked my dryer now dries our clothes"
Neutral,Positive,3.0,Cannot Wash,Cannot Wash. The handles are great but stains easily and it falls apart after washing.
Positive,Neutral,4.0,It seems to work good and is about one degree different then another one ...,It seems to work good and is about one degree different then another one .... It seems to work good and is about one degree different then another one i use so 
Positive,Neutral,4.0,considering its plastic and probably has a short life. ...,considering its plastic and probably has a short life. .... considering its plastic and probably has a short life . . . its looking and working ok . . . priced 
Negative,Positive,1.0,shoddy,"shoddy. as you can see in the photos, it looks like the insulation was just torn off-- also shearing some of the copper strands.  if the part you can see is thi"
Neutral,Positive,3.0,Three Stars,"Three Stars. Fits great, but wears out quickly."
Positive,Neutral,4.0,I bought two and they are both reading pretty close so they work and that's good,I bought two and they are both reading pretty close so they work and that's good. I bought two and they are both reading pretty close so they work and that's go
Neutral,Positive,3.0,This product is not the correct replacement for my Samsung ...,This product is not the correct replacement for my Samsung .... This product is not the correct replacement for my Samsung Refrigerator!  The replacement does n
Negative,Neutral,1.0,not enough tungsten,not enough tungsten. I had this part for three months and it burned out the wire will break. The reason is a lack of tungsten in heating coil wire this makes it
Negative,Neutral,1.0,Wouldn't fit,"Wouldn't fit. Item is good price for pk of 3. Seems to be good quailty. However, I couldn't get it to lock into place. I cross referenced the part numbers and i"
Positive,Negative,5.0,"don't know what the one star customers talking about, ...","don't know what the one star customers talking about, .... don't know what the one star customers talking about, I have my Miele for 17 years, and moved it with"
Negative,Neutral,1.0,"Cheap, plastic handle made in China","Cheap, plastic handle made in China. For the price of this I could just sand down and repaint the original handle where the paint just chipped off."
Negative,Positive,1.0,Went cheap to get good deal. Came home to kitchen flooded,Went cheap to get good deal. Came home to kitchen flooded. Went cheap to get good deal. Came home to kitchen flooded. Cost of fixing my kitchen floors far outwe
Positive,Neutral,4.0,Four Stars,Four Stars. ok
Neutral,Positive,3.0,I wasted 11 glasses of water before use but it taste ...,I wasted 11 glasses of water before use but it taste .... i replaced in my kenmore refrigerator. I wasted 11 glasses of water before use but it taste is not as 
Neutral,Positive,3.0,Not as easy to use as other per say,Not as easy to use as other per say. This product is so-so. Not as easy to use as other per say.
Positive,Neutral,5.0,VERY PRETTY,"VERY PRETTY. THESE ARE BEAUTIFUL ON MY STOVE.  I DON'T COOK MUCH, BUT I DO USE THE RANGE TOP AS A COUNTER.  THESE WORK VERY WELL.  I'VE PURCHASED SEVERAL DIFFER"
Neutral,Negative,3.0,Dented & broken,Dented & broken. Arrived with dents and broken pieces.
Neutral,Positive,3.0,These seem to be good quality hoses but the inside diameter is a bit ...,These seem to be good quality hoses but the inside diameter is a bit .... These seem to be good quality hoses but the inside diameter is a bit smaller thus taki
Positive,Neutral,5.0,Five Stars,Five Stars. not bad!
Neutral,Positive,3.0,Three Stars,"Three Stars. Love it, wish it had more speeds like soft or slow,  very powerful. Love it though!"
Positive,Negative,5.0,Good quality,"Good quality. There are burner covers being sold on the internet as stainless steel when in fact they are really just stainless steel LOOKING, while being flims"
Neutral,Positive,3.0,It works fine if the instructions are being followed!,It works fine if the instructions are being followed!. The filter will work fine and last long time only if special care of the operation of the humidifier is i
Positive,Negative,4.0,"I've Tried the ""MWF-Compatible"" filters - Staying with GE ""Genuine"" Filter","I've Tried the ""MWF-Compatible"" filters - Staying with GE ""Genuine"" Filter. We've owned our GE Side-by-side Refrigerator since 2008 and our family of six uses t"
Negative,Neutral,2.0,however it is not the best design or the best built or the best value ...,however it is not the best design or the best built or the best value .... The biggest liability of this unit is the handle to operate the door.  It is much too
Negative,Positive,1.0,I bought stainless steel hookups for half the price and they worked great.,"I bought stainless steel hookups for half the price and they worked great.. Maybe these hoses work for some things, but I bought these for a brand new portable "
Neutral,Positive,3.0,Three Stars,"Three Stars. fit well in my sink, though I did find it had fallen all the way in one time!"
Negative,Positive,1.0,not a good product.,not a good product.. O-ring on small (important) parts does not fit where the water drains....not a good product.
Positive,Negative,5.0,Such a waste of water,"Such a waste of water. Have to stick with these. Same as what they sell on the whirlpool site. Little cheaper here. Tried some other off brand kinds, and had to"
Neutral,Positive,3.0,Three Stars,Three Stars. not as fast as original equipment
Negative,Neutral,2.0,it does a wonderful job. This eliminated the excessive foaming caused by ...,"it does a wonderful job. This eliminated the excessive foaming caused by .... When it works, it does a wonderful job.  This eliminated the excessive foaming cau"
Negative,Positive,1.0,"cheap because not as good filtration, its a simple charcoal filter","cheap because not as good filtration, its a simple charcoal filter. Not NSF certified, cheap because not as good filtration, its a simple charcoal filter."
Negative,Positive,2.0,Two Stars,Two Stars. Does not keep beverages very cold
Positive,Neutral,4.0,Good performance and aesthetic.  Installation is a real challenge though!,"Good performance and aesthetic.  Installation is a real challenge though!. Once you get past the mounting task, it's worth it!  But first, it has to be mounted."
Neutral,Positive,3.0,Three Stars,"Three Stars. DO LIKE IT, BUT IT DOES NOT KEEP THINGS COLD ENOUGH"
Neutral,Positive,3.0,Does its job,"Does its job. Not alot to say it a piece of plastic, It will help me keep my kitchen looking clean so I'm happy"
Neutral,Positive,3.0,the washer now works fine.,"the washer now works fine.. This is the only kit sold for Whirlpool washers. I watched every single video i could see, and the parts on my washer were different"
Negative,Positive,1.0,I do not recommend this product for anything other than protecting the tips ...,I do not recommend this product for anything other than protecting the tips .... I worked at cleaning the rust off to bare metal for almost a week a couple of h
Positive,Negative,4.0,Cheaply made but the product does work and I can ...,Cheaply made but the product does work and I can .... Cheaply made but the product does work and I can for a ton of items in the dishwasher using these
Negative,Positive,2.0,"After going through many highly rated digital and analog thermometers that absolutely sucked, I am (so far) very pleased with this ...","After going through many highly rated digital and analog thermometers that absolutely sucked, I am (so far) very pleased with this .... UPDATED: the unit died a"
Negative,Neutral,2.0,So so,So so. I find this product to be flimsy and overpriced but does the job. It would have been better to come as a set of 2.
Neutral,Negative,3.0,Not worth saving $2,"Not worth saving $2. I bought these to use in an Aprilaire 500 unit, which this model claims to be compatible.
It might be compatible, but not a good fit.
Much "
Negative,Positive,1.0,Great Product,"Great Product. Great product if you do not have space for large dishwasher, works very well on economy if you have good hot water source.  Perfect for a couple."
Neutral,Negative,3.0,Beware of fit,Beware of fit. Beware it will not hit a GE stove.
Neutral,Positive,3.0,I Do Not Recommend,"I Do Not Recommend. I purchased this because of the good reviews on a number of sites and a low price.
The claim was that it cleaned as good or better than more"
Neutral,Positive,3.0,Good enough,Good enough. They didn't fit like original equipment but they work and that's what really counts.
Positive,Neutral,4.0,A Very Nice Product - Premier Pro is what you want!,"A Very Nice Product - Premier Pro is what you want!. If you're looking for a 6 burner gas range that's well designed, good looking and reasonably priced, this i"
Positive,Neutral,4.0,Four Stars,Four Stars. Delivery time and quality were good.
