label,LinearSVC_pred,overall,summary,text_preview
Negative,Positive,1.0,Fit and worked perfectly. For the price it was ...,"Fit and worked perfectly. For the price it was .... I had rated this a 5 previously for the time and effort it saved. Worked great, now 3 months in and I am pas"
Neutral,Negative,3.0,"Extremely labor-intensive, and effective. Ties clothes in knots. High water and detergent usage. Incredible but fussy spinner.","Extremely labor-intensive, and effective. Ties clothes in knots. High water and detergent usage. Incredible but fussy spinner.. This appears to be identical to "
Positive,Neutral,4.0,Four Stars,Four Stars. Color was a little lighter but everything else was ok
Positive,Negative,5.0,Five Stars,Five Stars. Fit my model
Positive,Neutral,5.0,Five Stars,Five Stars. It is ok
Positive,Neutral,5.0,This is made well. High quallity. Not flimsy ...,This is made well. High quallity. Not flimsy .... This is made well.  High quallity.  Not flimsy.
Positive,Negative,5.0,GREAT MACHINE. Somewhat short life.,"GREAT MACHINE. Somewhat short life.. WORTH IT. This ice maker worked wonderfully for about 1.5 years. Then it began to struggle and the interior tray cracked, r"
Positive,Negative,5.0,Buy these bearings!,"Buy these bearings!. High quality product. Do not waste your time trying to save $30-$40. I bought the cheap bearings last year, and wish I would have bought th"
Neutral,Positive,3.0,Good Generic Alternative,"Good Generic Alternative. Worked as a good generic option to the OEM version which costs 40 a piece. This product does the job. At first installation, the water"
Negative,Positive,2.0,Water taste great though.,Water taste great though.. Either our ice maker is leaking or these filters leak. Water taste great though.
Positive,Negative,4.0,As described. Filled the space,As described. Filled the space. Product did what the description said it would.  Very simple.
Negative,Positive,2.0,Not very pleased,"Not very pleased. I just realized how to leave feedback on my orders.  The filter is ""ok"", and we are using it, but I will not buy again.. This is not a replace"
Negative,Positive,2.0,Two Stars,Two Stars. Loose fit and continuously slides down the refrigerator doors.
Positive,Neutral,5.0,"Works good, doesn't really make different sizes","Works good, doesn't really make different sizes. Works good, doesn't really make different sizes. I like it... Saves so much room in the fridge, but takes up a "
Positive,Neutral,5.0,Good filters,"Good filters. I have used these filters before, this time I got the Holmes bacteriostat humidifier treatment to go along with it. These do not last more than a "
Negative,Positive,1.0,Worked fine for the first few minutes then after it cooled ...,Worked fine for the first few minutes then after it cooled .... Worked fine for the first few minutes then after it cooled off to around 35 outside the humidity
Neutral,Positive,3.0,Water filter,Water filter. Water tastes good however this is not equal to the Samsung original filter which removes more particulates  This filter only states the removal of
Positive,Neutral,4.0,Range Kleen 680 Plastic Kleen Seam,"Range Kleen 680 Plastic Kleen Seam. Although it don't fit as well as I would have liked it to, It keeps food particles and liquids from getting between the stov"
Positive,Neutral,4.0,"Looks nice but as far as quality, you get what you pay for","Looks nice but as far as quality, you get what you pay for. This range good looks nice and I get a lot of compliments on it. However, there is not sufficient ""c"
Positive,Neutral,5.0,Works fine . . . water now flows at full volume,Works fine . . . water now flows at full volume. Works fine.  Fixes water flow rate problem  . . . water now flows at full volume.  I neglected replacing for qu
Neutral,Negative,3.0,Diameter undersized,"Diameter undersized. The diameter is a bit small, so i had to stretch the filter to get the humidifier to close."
Neutral,Positive,3.0,but I would have been better off with the Watts D60U kit,"but I would have been better off with the Watts D60U kit. You will need this for some dishwashers, but I would have been better off with the Watts D60U kit. Tha"
Positive,Neutral,4.0,Four Stars,Four Stars. This is my 3rd valve. It works but it does fail over time.
Neutral,Negative,3.0,"Second in four years, not impressed","Second in four years, not impressed. My condenser fan went out back in 2010 and I replaced it with this unit. Fast forward to 2012 and here I am replacing it ag"
Positive,Negative,5.0,Happy With Purchase,"Happy With Purchase. I saw other reviews that said they received a different relay than what is pictured, so I purchased the relay directly from Amazon and rece"
Neutral,Positive,3.0,Good quality and installed perfectly.,Good quality and installed perfectly.. Parts worked out perfect for the up-keep of my dryer.
Neutral,Negative,3.0,Ill only use whirlpoolwater filter.,"Ill only use whirlpoolwater filter.. Did not like this filter.  When we replaced the water filter with this, what looked like paper floated around in the water."
Negative,Positive,2.0,Perfect fit - but still expensive for what it is ...,Perfect fit - but still expensive for what it is .... Perfect fit - but still expensive for what it is - and because of the all plastic design is still suscepti
Negative,Positive,2.0,Little loose then original,Little loose then original. Little loose then original
Neutral,Positive,3.0,Fixed it with some supper glue and all better. Otherwise works great,Fixed it with some supper glue and all better. Otherwise works great. Cute sign. Only problem is the sign kept falling off the magnate onto the floor. Fixed it 
Negative,Positive,2.0,Two Stars,Two Stars. They are upside down...
Neutral,Positive,3.0,"Works well, but I find the screen to be very dark and hard to read.","Works well, but I find the screen to be very dark and hard to read.. Works well, but I find the screen background to be very dark and therefore hard to read the"
Neutral,Positive,3.0,Not what they going to be,Not what they going to be. Not what they going to be
Negative,Positive,1.0,"While it worked it was great, made more than enough ice with no problems","While it worked it was great, made more than enough ice with no problems. In less than 2 months it stopped working.  Received it on Sept 08, 2017, stopped worki"
Positive,Neutral,4.0,Four Stars,Four Stars. worked ok
Neutral,Positive,3.0,These do not fit very well. They're just a ...,"These do not fit very well. They're just a .... These do not fit very well. They're just a little off, causing the pans to tilt slightly. Since I have an older "
Neutral,Positive,3.0,Not a a Whirlpool part,"Not a a Whirlpool part. I received the element quickly, but when I opened the box I noticed the heating element had no part number and was stamped only with the"
Negative,Neutral,2.0,Two Stars,Two Stars. Don't install lint mesh... it gets clogged withing a few weeks.
Neutral,Negative,3.0,Three Stars,Three Stars. Very thin material can crumple up if too much load is put on them. Second set!
Positive,Negative,5.0,Not right size,Not right size. One size does not fit all disherwashers. This was  not the right size. I have returned it.
Positive,Neutral,5.0,Good as original.,"Good as original.. Like the original. We've purchased after market burner trays in the past and have never had any luck. Either they don't quite fit, mar too ea"
Negative,Positive,2.0,Puddles,Puddles. We loved the look of this refrigerator.  The glass shelves are great and you can pack a ton of food/drinks into it.  We plugged it in on Wednesday and 
Negative,Neutral,2.0,"The product seemed carelessly made, thin and flimsy. ...","The product seemed carelessly made, thin and flimsy. .... The product seemed carelessly made, thin and flimsy. It required trimming and fitting. In future, the "
Positive,Negative,4.0,As expected,As expected. Product was as expected and advertised. Did not end up needing or using and returned for refund.
Positive,Neutral,5.0,Quality seems good and they went on smoothly,Quality seems good and they went on smoothly. Quality seems good and they went on smoothly. They're a few months old now and haven't thought about them. So that
Neutral,Positive,3.0,The product is great but the fit is a bit awkward for my ...,The product is great but the fit is a bit awkward for my .... The product is great but the fit is a bit awkward for my stove/countertop. As this product is soli
Positive,Neutral,4.0,Four Stars,Four Stars. Wasn't to bad to fix once I saw the you tube video.
Positive,Negative,5.0,Way to go Amazon,Way to go Amazon. in the past I have refrigerators that required a filter for the water/ice maker  but never notice and air filter. bought this fridge two years
Neutral,Positive,3.0,Whirlpool fridge filter works but expensive.,Whirlpool fridge filter works but expensive.. Great taste for our fridge water. Unfortunately with this new style the price went way up. No noticeable change in
Negative,Positive,1.0,First impression - Fail,First impression - Fail. Purchased a house with one installed.  It takes forever to boil water.  The glass control panel shattered on its own (no joke... nobody
Neutral,Negative,3.0,Short-term normal quality washer.,"Short-term normal quality washer.. Hard to use, but can be helpful for casual use. not for the large amount of clothes. If you want to buy long-term washer it's"
Positive,Negative,4.0,Weak handle,"Weak handle. The handle is weak,  it can be removed with a screwdriver defeat the purpose of locking the freezer."
Neutral,Positive,3.0,Fits but not quite the same,Fits but not quite the same. I ordered a water filter hat was described as being the same as the Kenmore model.  It was significantly less expensive.  While it 
Neutral,Negative,3.0,16 Pack of WB02T10461,"16 Pack of WB02T10461. Bought these to replace the ones that came with our stove, but they melted like the originals on by the hottest burner on the cook top.  "
Negative,Positive,1.0,I recommend against this range,"I recommend against this range. I recommend against this range. If you use the stove top and oven at the same time, hot air blows out the front of the unit onto"
Negative,Neutral,1.0,Ok oven AVOID the seller.,Ok oven AVOID the seller.. 2nd review being posted.  They did not have my permission to remove the first review.  They called and asked if I would accept money 
Negative,Positive,1.0,DO NOT BUY this dryer or set,"DO NOT BUY this dryer or set. I buy the this dryer, and within 2 years, I have replace the thermostat once ($20 value), and the heater element twice ($216 value"
Positive,Negative,5.0,they work well,"they work well. paper lined with a thin sheet of plastic - i was skeptical. Have been happily proved wrong...these bags don't leak or break through, and i've tr"
Negative,Positive,1.0,It was first time buying this.,It was first time buying this.. It was first time buying this. I thought it was going to change a bit the taste our water instead it was the same
Neutral,Positive,3.0,The samsung filter made the water taste much better.,The samsung filter made the water taste much better.. It fits right but the water tastes the same as what comes out of the faucet. The samsung filter made the w
Negative,Neutral,2.0,Two Stars,"Two Stars. Didn't fit, sent back."
Positive,Neutral,5.0,Great part to fix an overflow problem,Great part to fix an overflow problem. The part I received has the larger cup that is the Genuine GE part.  Others substitute a smaller cup that will overflow a
Neutral,Positive,3.0,Three Stars,Three Stars. When it arrived it was badly damaged
Positive,Neutral,5.0,Five Stars,Five Stars. Right part but wrong connector but used old connector to make it work
Neutral,Positive,3.0,It's a filter.....,"It's a filter...... Duh, its a filter, what can you say about it.... and I own an HVAC business!!  Works as it should!!???"
Negative,Positive,1.0,One Star,One Star. Good product and fast shipping.  It was evere thing just as advertised
Negative,Positive,1.0,Works great not anymore,Works great not anymore. It is working great. We like it a lot. Thank you Keith It's broken less than one year. The flap node broke no more ice. Spent to much. 
Neutral,Positive,3.0,Three Stars,"Three Stars. not as good as the original, but a good cheap alternative."
Positive,Neutral,4.0,Four Stars,Four Stars. OK
Negative,Neutral,2.0,Overpriced and inadequate,"Overpriced and inadequate. I purchased a set of Amana stackable washer/dryer 2nd hand (craigslist), but the seller used them as side by side, so I did a search "
Neutral,Positive,3.0,"Looks good. Easy DIY Install, Fan is LOUD any setting.","Looks good. Easy DIY Install, Fan is LOUD any setting.. Plastic vent is 6 not 8  Looks good, easy install. Fan is loud any setting."
Positive,Neutral,4.0,Very Good Product,"Very Good Product. This hood is a very good hood at an extremely good price.  Unfortunately, I ordered the wrong one (my fault) and had to return it.  It was fr"
Negative,Neutral,2.0,Not for the price,Not for the price. The covers looked okay but the drop pans did not fit at all. The stove covers also looked really cheap.
Neutral,Negative,3.0,Noisy Filter,Noisy Filter. Somehow this filter is noisy when dispensing water (or ice maker is engaged). It's loud enough to be annoying and reason to not purchase again. No
Neutral,Positive,3.0,not perfect.,"not perfect.. Fits but, not perfect."
Positive,Neutral,5.0,Improved design is less likely to spill over than the ...,Improved design is less likely to spill over than the .... Improved design is less likely to spill over than the 10 year old original. This one has a raised edg
Positive,Negative,4.0,"it does not have option to light the screen, ...","it does not have option to light the screen, .... it does not have option to light the screen , hence you can not read the reading when it is little dark or too"
Negative,Positive,2.0,I bought these to replace the gasket of our freezer ...,"I bought these to replace the gasket of our freezer .... I bought these to replace the gasket of our freezer.  They arrived all kinked and, even after soaking t"
Negative,Positive,2.0,I hate my washer,I hate my washer. I purchased 3 of these for my stupid washer. I don't know if it's the washer or the bellow. But where the gussets are where the drain is at th
Neutral,Negative,3.0,Not sure I would buy this again.,"Not sure I would buy this again.. Items were sent in a timely manner.  However, I thought the items were dishwasher proof but the plain pan started to crinkle a"
Positive,Neutral,4.0,They do everything the are supposed to,"They do everything the are supposed to. After turning on the wrong burner and smoking my old cover, I ordered these as replacements. They ARE made of lightweigh"
Neutral,Positive,3.0,filter o ring,"filter o ring. i recieved the product, if it was the right one i would love it.  It was a little too big and too thin. but thats ok i will just keep it someone "
Neutral,Negative,3.0,Needs Some Headroom...,"Needs Some Headroom.... These work as an odor filter as long as they don't get clogged with grease vapors.
I also had a problem when I installed a new filter..."
Negative,Positive,2.0,Two Stars,Two Stars. Inner gear dimensions do not match factory specs.  Had to use old sprocket.
Neutral,Negative,3.0,"Didn't solve my issue, but CS was good","Didn't solve my issue, but CS was good. It worked great at first. Was able to run a load, but than a few weeks later it started doing the same thing as before ("
Positive,Neutral,5.0,Five Stars,Five Stars. ToBe Utilized in Recently Purchased Small Freezer to Eliminate Frost Build-Up.
Neutral,Positive,3.0,So far so good.,So far so good.. Hopefully long term use will provide desired and advertised results. So far so good.
Neutral,Positive,3.0,Disappointment not expected,Disappointment not expected. I received my new Maytag Centennial washer as a Christmas gift from our daughter. I was so excited to get a new washer with high ca
Negative,Positive,1.0,I thought this attachment would be great. Nope,I thought this attachment would be great. Nope. I thought this attachment would be great. Nope. I now have oil/grease stains all over my clothes from the fabric
Positive,Negative,5.0,I am delighted with this washer,I am delighted with this washer. I am delighted with this washer. M only regret is that I did not purchase the larger model: one cubic foot is small!
Negative,Positive,1.0,Do not buy an appliance from Fisher Paykel,"Do not buy an appliance from Fisher Paykel. I spent a great deal of money on what I had been led to believe was a quality product, but I have had nothing but pr"
Negative,Positive,2.0,but they didn't have the outside felt like exterior like the original,"but they didn't have the outside felt like exterior like the original. Can't give any fair assessment. Received filters, but they didn't have the outside felt l"
Neutral,Negative,3.0,Wrong and missing parts,Wrong and missing parts. I am giving this 3 stars because it does not come with all the parts needed to install to your fridge. The piercing saddle has instruct
Positive,Negative,5.0,Saved me so much money!,"Saved me so much money!. Our icemaker went out in our Whirlpool side-by-side refrigerator, and after months of avoiding dealing with it by buying ice every few "
Neutral,Positive,3.0,Great machine if it didn't leak...,"Great machine if it didn't leak.... So far a good machine. However, the instructions are extremely lacking. First there was a plug in a package but there was no"
Positive,Neutral,5.0,"My to rack doesn't fall out any more, so ...","My to rack doesn't fall out any more, so .... My to rack doesn't fall out any more, so it works. This is actually an upgrade to the original rack brackets becau"
Negative,Neutral,2.0,Two Stars,Two Stars. doesn't fit my sink
Positive,Negative,5.0,My garbage disposal had stopped working for a few days,"My garbage disposal had stopped working for a few days. My garbage disposal had stopped working for a few days, when I learned about these wrenches. I'm not sur"
Neutral,Positive,3.0,Don't know how long this one will last,Don't know how long this one will last. It was a replacement for the last one I bought 1 year ago.
Positive,Negative,4.0,Shiny vs matted black finish,"Shiny vs matted black finish. Although the part number matched what my stove called for, the color is a shiny black. My stove has matted black grates. It'll hav"
Neutral,Negative,3.0,Good quality with some annoyances,"Good quality with some annoyances. Good quality, and an improvement over some earlier models. However, the front panel arrived with some minor denting on the bo"
Neutral,Positive,3.0,Good price compared to Lowes but you need to run ...,"Good price compared to Lowes but you need to run .... Good price compared to Lowes but you need to run several gallons through it before drinking the water, to "
Neutral,Negative,3.0,Not a bad basic range bag,"Not a bad basic range bag. I bought this as my first range bag. The 2 pouches for gun are awful in my opinion, the are super thin and the velcro is awful, I end"
Positive,Negative,4.0,The range hood has only been used for a week ...,"The range hood has only been used for a week .... The range hood has only been used for a week, one of the halogen lamp has dead.

This is an update on my 2 sta"
Neutral,Positive,3.0,Good product but installation is not easy.,Good product but installation is not easy.. The product seems to be sturdy and made of high quality material. It has two fans therefore it could be powerful and
Positive,Negative,5.0,Probably should have purchased from a store,"Probably should have purchased from a store. Even though the box was pretty stout, mine still arrived bent approx 30 degrees.  Not a corner bend like many here "
Positive,Neutral,5.0,Five Stars,Five Stars. Not cheap but does the job.
Neutral,Positive,3.0,Three Stars,Three Stars. They did the job. I needed to bend or trim the filter to fit.
Positive,Negative,4.0,They work great but one star knockdown for one of the filters ...,"They work great but one star knockdown for one of the filters .... This is my third set of these OEM original filters. This last set, the filter clogged about 2"
Negative,Positive,1.0,not a replacement filter its a clip on,not a replacement filter its a clip on. not a replacement filter its a clip on
Positive,Neutral,4.0,Decent but louder than expected.,"Decent but louder than expected.. It looks nice, has good suction and good light.  I feel it is much louder even at low setting and that is an aspect their engi"
Negative,Positive,2.0,I didn't know I could just screw the dishwasher into ...,I didn't know I could just screw the dishwasher into .... I didn't know I could just screw the dishwasher into the side cabinets. Didnt end up needing all these
Neutral,Positive,3.0,Three Stars,Three Stars. Was correct handle... Havn't used as I fixed my old one with JB Weld.
Negative,Positive,1.0,there is not a good seal and the water filter leaks,"there is not a good seal and the water filter leaks. These are shorter than the name brand ones from Kenmore, so when you install them, there is not a good seal"
Neutral,Negative,3.0,Probabaly not the quality of LG filters.,"Probabaly not the quality of LG filters.. After the installation, the water was dark (maybe charcoal filter material?) for the first 2 gallons while flushing wh"
Neutral,Positive,3.0,It is the right price,It is the right price. I have had no problem with it. I like it so far its been 2 months of use. It has worked for me.
Positive,Neutral,5.0,Works with my Kenmore humidifier.,Works with my Kenmore humidifier.. Shipped and arrived as expected. Wasnt sure if it would work or not because it didn't list my model number. But I measured th
Positive,Neutral,4.0,Appears to work,"Appears to work. Instructions were for refrigerator gasket, not dishwasher. Was not exactly what we took out of our dishwasher, had to make adjustments, first r"
Positive,Neutral,5.0,"Works perfect, looks beautiful, Beers cold!","Works perfect, looks beautiful, Beers cold!. I read all the negative reviews, and like you questioned it. But comparing to other fridges with lesser reviews I w"
Negative,Positive,2.0,Unexpected melting.,"Unexpected melting.. This worked for less then a month, this pump's pivot point melted causing a leak out of the center apex on the front face.&nbsp;<a data-hoo"
Positive,Neutral,4.0,A good chinese deal compared to italian products...,"A good chinese deal compared to italian products.... This matches my white upper high gloss cabinets from IKEA. It's different, yet functional. Ok to install, n"
Positive,Negative,4.0,Four Stars,"Four Stars. Did not plug directly in, but did come with instructions on how to install properly"
Negative,Positive,2.0,Not as advertised...,Not as advertised.... I have an older Frigidaire refrigerator (made before they became an Electrolux product) with ice and water through the door.  Although its
Negative,Neutral,2.0,They should have tested it or done a better job protective wires before pulling it in through the ...,"They should have tested it or done a better job protective wires before pulling it in through the .... Its okay, but quality control is lacking.
First the inter"
Positive,Neutral,4.0,Four Stars,Four Stars. Its okay
Negative,Neutral,1.0,Argh.,"Argh.. Bought it, it didn't fit. Screws in but doesn't seat. No flow. Wish I had read other reviews. Hey guys.. Amazon..it doesn't fit ge profile models having "
Negative,Neutral,2.0,Ok,Ok. No way to fit these properly
Positive,Neutral,5.0,Works good to expose nefarious coworkers.,"Works good to expose nefarious coworkers.. I bought this because my office is essentially a site located doublewide and the A/C unit, and thermostat, is located"
Negative,Neutral,2.0,Doesn't come with instructions to install.,"Doesn't come with instructions to install.. It had a few dings in it, which I can live with but it didn't come with installation instructions  which makes it ve"
Negative,Neutral,2.0,Two models died over 2 years - find something else,Two models died over 2 years - find something else. I've had two of these units for my shop over the past two years. The second unit seems to have had the same 
Neutral,Positive,3.0,Working okay so far but drainage hose leaks,Working okay so far but drainage hose leaks. I love this thing. I cannot even describe to you how much I hate cleaning dishes. I have a full time job and when I
Neutral,Positive,3.0,Disappointed,Disappointed. I love the dryer but it sticks on the spin button and that's not helpful.
Positive,Neutral,5.0,Five Stars,Five Stars. these seems to work okay
Neutral,Positive,3.0,Amazing Amazon service,"Amazing Amazon service. The hose was a little short, so had to return this kit.  Amazing Amazon service, as always."
Neutral,Positive,3.0,NOT METAL,NOT METAL. Key works but not metal like advertised.
Positive,Neutral,5.0,OEM Replacement Part Works Perfectly!,"OEM Replacement Part Works Perfectly!. My LG WM2455HG front loader was giving an ""FE"" Error Code whenever I would run a wash cycle of more than 20-30 minutes (a"
Neutral,Negative,3.0,"For wm2016cw washers, get MDS33059401 with no drain port.","For wm2016cw washers, get MDS33059401 with no drain port.. Good replacement part, but the product description incorrectly states it is compatible with wm2016cw."
Positive,Negative,5.0,Five Stars,Five Stars. This wouldn't fit but they refunded my money
Neutral,Positive,3.0,Three Stars,Three Stars. works - price is rediculous
Negative,Neutral,1.0,The length does not fit my dish washer.,The length does not fit my dish washer.. I don't know if it fits to my dish washer. Just give it a try. it is too long anyway.
Negative,Positive,1.0,Samsung destroys former great product,Samsung destroys former great product. Samsung has destroyed what was a great product. We just replaced our 2 year old version of this model due to defect. The 
