dataset_index,text_excerpt,original_rating,inferred_label,inferred_rating,enhanced_rating
139323,"Saved by the ""stat."". Product fit refrigerator perfectly with only a few minor adjustments. It took only a few minutes to install. The refrigerator is now working perfectly and ...",1.0,Positive,4.5,1.35
279832,Perfect fit. Most Excellent Product and Service. Perfect fit. Most Excellent Product and Service!!! Thank You,1.0,Positive,4.5,1.35
327639,... thinks this image is too scary - and she love horror films - go figure. My wife thinks this image is too scary - and she love horror films - go figure....,1.0,Positive,4.5,1.35
310767,Just as described. This kit worked perfectly.,1.0,Positive,4.5,1.35
332538,"We were totally amazed!. Yes, it was exactly what we needed! It came quickly. We were totally amazed!",1.0,Positive,4.5,1.35
